{
  "schema_version": "1.0",
  "dataset": {
    "id": "neuro-research-demo",
    "title": "Source-grounded autophagy assay neighborhood: Vici, BPAN, and AP-4-HSP",
    "description": "Small literature demonstration of one Vici/EPG5 candidate assay alongside mechanistically adjacent but distinct BPAN/WDR45 and SPG47/AP4B1 studies. Not a clinical recommendation.",
    "synthetic": false,
    "created_at": "2026-10-04"
  },
  "nodes": [
    {
      "id": "disease:vici",
      "type": "Disease",
      "label": "Vici syndrome",
      "aliases": [
        "Vici syndrome"
      ],
      "properties": {
        "inheritance": "autosomal recessive"
      }
    },
    {
      "id": "gene:EPG5",
      "type": "Gene",
      "label": "EPG5",
      "aliases": [
        "ectopic P-granules autophagy protein 5"
      ],
      "properties": {}
    },
    {
      "id": "disease:bpan",
      "type": "Disease",
      "label": "Beta-propeller protein-associated neurodegeneration",
      "aliases": [
        "BPAN"
      ],
      "properties": {}
    },
    {
      "id": "gene:WDR45",
      "type": "Gene",
      "label": "WDR45",
      "aliases": [
        "WIPI4"
      ],
      "properties": {}
    },
    {
      "id": "disease:spg47",
      "type": "Disease",
      "label": "Adaptor protein complex 4-associated hereditary spastic paraplegia",
      "aliases": [
        "AP-4-HSP",
        "SPG47"
      ],
      "properties": {}
    },
    {
      "id": "gene:AP4B1",
      "type": "Gene",
      "label": "AP4B1",
      "aliases": [
        "beta-4 subunit of adaptor protein complex 4"
      ],
      "properties": {}
    },
    {
      "id": "mechanism:autophagy",
      "type": "Mechanism",
      "label": "Autophagy pathway",
      "aliases": [
        "autophagy"
      ],
      "properties": {}
    },
    {
      "id": "asset:vici-tandem-lc3",
      "type": "Asset",
      "label": "Tandem fluorescent LC3 fusion reporter in EPG5-knockout HeLa cells",
      "aliases": [
        "tf-LC3 assay",
        "mRFP-GFP-LC3 reporter"
      ],
      "properties": {
        "status": "published cell-model assay; transferability and access unverified",
        "method_type": "tandem fluorescent reporter microscopy",
        "interpretation_caveat": "The paper interprets reporter fluorescence/colocalization as reduced autophagosome–lysosome fusion; this is a cellular proxy, not direct visualization of membrane fusion. The separate LC3/LAMP1 colocalization readout is also indirect."
      }
    },
    {
      "id": "asset:bpan-lc3-hci",
      "type": "Asset",
      "label": "High-content LC3 puncta assay in WDR45/BPAN neural models",
      "aliases": [
        "BPAN LC3 assay"
      ],
      "properties": {
        "method_type": "high-content immunofluorescence"
      }
    },
    {
      "id": "asset:ap4-atg9a-hci",
      "type": "Asset",
      "label": "High-content ATG9A TGN distribution assay",
      "aliases": [
        "AP-4 ATG9A ratio assay"
      ],
      "properties": {
        "method_type": "high-content confocal imaging"
      }
    }
  ],
  "sources": [
    {
      "id": "epg5-vici-fusion-2018",
      "title": "Defects in autophagosome-lysosome fusion underlie Vici syndrome, a neurodevelopmental disorder with multisystem involvement",
      "url": "https://pmc.ncbi.nlm.nih.gov/articles/PMC5471274/",
      "kind": "paper",
      "published_at": null,
      "retrieved_at": "2026-10-04",
      "license": "CC BY 4.0",
      "version": "c2a801ac46b71b7e004b9c243d3ddb7e356c08a21c47f5f9c59741e9494e8c9a",
      "synthetic": false,
      "status": "active"
    },
    {
      "id": "wdr45-bpan-2023",
      "title": "Cardiac glycosides restore autophagy flux in an iPSC-derived neuronal model of WDR45 deficiency",
      "url": "https://pmc.ncbi.nlm.nih.gov/articles/PMC10515824/",
      "kind": "paper",
      "published_at": null,
      "retrieved_at": "2026-10-04",
      "license": "CC BY-NC-ND 4.0 International",
      "version": "241d300a8c6d1622d6a6edc2b63093c960311b4d2d762d111db13d1e6c340edf",
      "synthetic": false,
      "status": "active"
    },
    {
      "id": "ap4b1-atg9a-2024",
      "title": "High-content screening identifies a small molecule that restores AP-4-dependent protein trafficking in neuronal models of AP-4-associated hereditary spastic paraplegia",
      "url": "https://pmc.ncbi.nlm.nih.gov/articles/PMC10794252/",
      "kind": "paper",
      "published_at": null,
      "retrieved_at": "2026-10-04",
      "license": "CC BY 4.0 International",
      "version": "77a97b4be31a34fefe345f631aa43b3eb5ba4db1ccf677240b7b72ec7c6896e8",
      "synthetic": false,
      "status": "active"
    },
    {
      "id": "ap4b1-fibroblast-2021",
      "title": "High-throughput imaging of ATG9A distribution as a diagnostic functional assay for adaptor protein complex 4-associated hereditary spastic paraplegia",
      "url": "https://pmc.ncbi.nlm.nih.gov/articles/PMC8557665/",
      "kind": "paper",
      "published_at": null,
      "retrieved_at": "2026-10-04",
      "license": "CC BY-NC 4.0 International",
      "version": "5c5014a71e31d7742f5e3ff4d590f9934dbe721dfec223c183d9e8d86448f447",
      "synthetic": false,
      "status": "active"
    }
  ],
  "claims": [
    {
      "id": "claim:vici-involves-fusion",
      "subject": "disease:vici",
      "predicate": "INVOLVES",
      "object": "mechanism:autophagy",
      "assertion_type": "reported",
      "context": {
        "mechanism_step": "autophagosome–lysosome fusion"
      },
      "extraction_confidence": 0.96
    },
    {
      "id": "claim:vici-assay-measures-fusion",
      "subject": "asset:vici-tandem-lc3",
      "predicate": "MEASURES",
      "object": "mechanism:autophagy",
      "assertion_type": "reported",
      "context": {
        "mechanism_step": "autophagosome–lysosome fusion",
        "readout": "mRFP-GFP-LC3 tandem reporter fluorescence; RFP/GFP Pearson colocalization",
        "species": "Homo sapiens",
        "tissue": "EPG5-knockout HeLa cells"
      },
      "extraction_confidence": 0.92
    },
    {
      "id": "claim:bpan-involves-formation",
      "subject": "disease:bpan",
      "predicate": "INVOLVES",
      "object": "mechanism:autophagy",
      "assertion_type": "reported",
      "context": {
        "mechanism_step": "early autophagosome formation"
      },
      "extraction_confidence": 0.96
    },
    {
      "id": "claim:bpan-assay-measures-formation",
      "subject": "asset:bpan-lc3-hci",
      "predicate": "MEASURES",
      "object": "mechanism:autophagy",
      "assertion_type": "reported",
      "context": {
        "mechanism_step": "early autophagosome formation",
        "readout": "LC3 puncta count (autophagosome proxy)",
        "species": "Homo sapiens",
        "tissue": "iPSC-derived midbrain dopaminergic progenitors"
      },
      "extraction_confidence": 0.95
    },
    {
      "id": "claim:spg47-involves-atg9a",
      "subject": "disease:spg47",
      "predicate": "INVOLVES",
      "object": "mechanism:autophagy",
      "assertion_type": "reported",
      "context": {
        "mechanism_step": "AP-4-dependent ATG9A trafficking"
      },
      "extraction_confidence": 0.94
    },
    {
      "id": "claim:ap4-assay-measures-atg9a",
      "subject": "asset:ap4-atg9a-hci",
      "predicate": "MEASURES",
      "object": "mechanism:autophagy",
      "assertion_type": "reported",
      "context": {
        "mechanism_step": "AP-4-dependent ATG9A trafficking",
        "readout": "ATG9A fluorescence ratio in TGN46-positive trans-Golgi mask versus remainder of cell body",
        "species": "Homo sapiens",
        "tissue": "patient-derived fibroblasts"
      },
      "extraction_confidence": 0.96
    },
    {
      "id": "claim:vici-asset-relevance",
      "subject": "asset:vici-tandem-lc3",
      "predicate": "RELEVANT_TO",
      "object": "disease:vici",
      "assertion_type": "inferred",
      "context": {
        "rationale": "asset is reported in the target disease; feasibility still requires human review"
      },
      "extraction_confidence": 0.55
    },
    {
      "id": "claim:bpan-comparison-relevance",
      "subject": "asset:bpan-lc3-hci",
      "predicate": "RELEVANT_TO",
      "object": "disease:vici",
      "assertion_type": "inferred",
      "context": {
        "rationale": "adjacent autophagy assay for comparison; distinct early mechanism step"
      },
      "extraction_confidence": 0.55
    },
    {
      "id": "claim:ap4-comparison-relevance",
      "subject": "asset:ap4-atg9a-hci",
      "predicate": "RELEVANT_TO",
      "object": "disease:vici",
      "assertion_type": "inferred",
      "context": {
        "rationale": "adjacent autophagy trafficking assay for comparison; distinct cargo-trafficking step"
      },
      "extraction_confidence": 0.55
    }
  ],
  "evidence": [
    {
      "id": "evidence:vici-anchor",
      "claim_id": "claim:vici-involves-fusion",
      "source_id": "epg5-vici-fusion-2018",
      "locator": "character offsets 0-1371 in neuro_documents.json text",